{"event_id":"H2EPR-0892","lifecycles":[{"initial_state":"submitted","lifecycle_id":"action_disposition","terminal_states":["accepted","rejected"],"transitions":[{"from":"submitted","owner":"masim.AuthoritativeReducer","to":"accepted","trigger":"intent admission and effect validation pass"},{"from":"submitted","owner":"masim.AuthoritativeReducer","to":"rejected","trigger":"authority, parameter, precondition, or conflict validation fails"}]},{"initial_state":"pending","lifecycle_id":"message_delivery","terminal_states":["delivered","expired","rejected","duplicate","failed"],"transitions":[{"from":"pending","owner":"masim.AppendOnlyTransport","to":"delivered","trigger":"transport reaches delivered"},{"from":"pending","owner":"masim.AppendOnlyTransport","to":"expired","trigger":"transport reaches expired"},{"from":"pending","owner":"masim.AppendOnlyTransport","to":"rejected","trigger":"transport reaches rejected"},{"from":"pending","owner":"masim.AppendOnlyTransport","to":"duplicate","trigger":"transport reaches duplicate"},{"from":"pending","owner":"masim.AppendOnlyTransport","to":"failed","trigger":"transport reaches failed"}]}],"registry_id":"h2epr.0892.lifecycle-registry.v1","registry_sha256":"a28f490f12a58c8284a8b0176a11605ed133bf948980bd1bbe94409dd26f5015","registry_version":"1.0.1","schema_version":"h2epr.lifecycle-registry.v2"}
